{
  "provider_key": "github",
  "family_key": "copilot",
  "soul_label": "inline_code_completer",
  "in_one_sentence": "The predictive partner specialized in real-time IDE-level code assistance.",
  "communication_style": ["predictive", "fragmentary", "in-line", "efficient"],
  "reasoning_style": ["pattern_completion", "dependency-aware", "real-time"],
  "best_fit_roles": ["code_assistant", "pair_programmer", "IDE_tether"],
  "worst_fit_roles": ["long_form_essayist", "multi-doc_researcher"],
  "when_to_use": "In-file code completion, quick refactoring, snippet generation.",
  "when_not_to_use": "Deep architectural design or massive cross-repository codebase analysis outside the IDE.",
  "key_differentiators": {
    "context_handling": "Window-locked to current file and surrounding buffers.",
    "truth_vs_speed": "Ultra-fast, optimized for IDE latency.",
    "cultural_anchor": "Developer-centric, automation-first.",
    "product_vs_model": "Productized intelligence wrapper for coding."
  }
}
