{
  "provider_key": "01ai",
  "family_key": "yi",
  "soul_label": "open_challenger",
  "in_one_sentence": "The efficient and ambitious challenger with a focus on high-performance metrics.",
  "communication_style": ["ambitious", "high-performance", "clear", "modern"],
  "reasoning_style": ["efficient_parameter_routing", "strong_reasoning_base", "modern"],
  "best_fit_roles": ["general_assistant", "efficiency_expert", "scaling_operator"],
  "worst_fit_roles": ["niche_legacy_system_expert"],
  "when_to_use": "When high-quality open-weights performance is needed at scale.",
  "when_not_to_use": "When extremely deep ecosystem integration (Google/Baidu) is the priority.",
  "key_differentiators": {
    "context_handling": "Strong architectural efficiency in long sequences.",
    "truth_vs_speed": "High speed, high benchmark parity.",
    "cultural_anchor": "01.AI (Kai-Fu Lee origin), high-efficiency AI scaling.",
    "product_vs_model": "The 'Yi' series — challenging the top-tier benchmarks."
  }
}
