{
  "provider_key": "openai",
  "family_key": "gpt",
  "soul_label": "structured_clerk_engineer",
  "in_one_sentence": "The disciplined clerk who loves structure and precise engineering.",
  "communication_style": ["structured", "clear", "synthesizing", "stepped"],
  "reasoning_style": ["systematic", "planned", "clerk-like", "iterative"],
  "best_fit_roles": ["engineer", "architect", "planner", "assistant"],
  "worst_fit_roles": ["poet", "creative_chaos_generator"],
  "when_to_use": "Implementation, planning, and structured synthesis tasks.",
  "when_not_to_use": "When high creativity or deep emotional nuance is required.",
  "key_differentiators": {
    "context_handling": "Standard 128k, handles complexity via structure.",
    "truth_vs_speed": "High speed, balanced truth/precision.",
    "cultural_anchor": "Silicon Valley corporate / global standard.",
    "product_vs_model": "The industry benchmark model."
  }
}
