{
  "provider_key": "alibaba",
  "family_key": "qwen",
  "soul_label": "versatile_open_generalist",
  "in_one_sentence": "The clear and versatile polymath specializing in bilingual and generalist knowledge.",
  "communication_style": ["clear", "bilingual_fluent", "structured", "balanced"],
  "reasoning_style": ["polymathic", "balanced", "cross-cultural", "logical"],
  "best_fit_roles": ["bilingual_assistant", "generalist_researcher", "math_and_logic_solver"],
  "worst_fit_roles": ["extreme_western_slang_specialist"],
  "when_to_use": "Bilingual (CN/EN) workflows, strong math/logic base, generalist tasks.",
  "when_not_to_use": "When deep niche Western cultural subtext is the only requirement.",
  "key_differentiators": {
    "context_handling": "Expanding context limits, strong performance on benchmark data.",
    "truth_vs_speed": "Balanced speed and high benchmark fidelity.",
    "cultural_anchor": "Alibaba/Chinese HQ, truly global bilingual performance.",
    "product_vs_model": "Leading open-weights family for large-scale versatility."
  }
}
