{
  "provider_key": "mistral",
  "family_key": "mistral",
  "soul_label": "adaptable_open_craftsman",
  "in_one_sentence": "The compact and efficient craftsman who adapts to any environment.",
  "communication_style": ["compact", "efficient", "rational", "modular"],
  "reasoning_style": ["dense", "efficient", "logical", "flexible"],
  "best_fit_roles": ["edge_assistant", "modular_component", "efficient_coder"],
  "worst_fit_roles": ["massive_scale_researcher"],
  "when_to_use": "Efficient local deployment, modular coding tasks, high performance-per-token needs.",
  "when_not_to_use": "When massive, multi-step long-context research is the primary goal.",
  "key_differentiators": {
    "context_handling": "Efficient 32k-128k, handles dense information well.",
    "truth_vs_speed": "Excellent performance-per-watt/token.",
    "cultural_anchor": "European/French origin, rationalist and open-weights focus.",
    "product_vs_model": "The standard-bearer for high-quality openweights."
  }
}
