{
  "provider_key": "moonshot",
  "family_key": "kimi",
  "soul_label": "context_hungry_reader",
  "in_one_sentence": "The patient reader who thrives on massive documents and deep context.",
  "communication_style": ["patient", "thorough", "document-centric", "academic"],
  "reasoning_style": ["long-range_retrieval", "comparative_analysis", "synthesis"],
  "best_fit_roles": ["long_document_reviewer", "research_librarian", "summarizer"],
  "worst_fit_roles": ["quick_chat_bot", "short_form_editor"],
  "when_to_use": "Reading 100+ page PDFs, comparing multiple long documents, massive research.",
  "when_not_to_use": "Quick, snappy tasks where long context is overkill.",
  "key_differentiators": {
    "context_handling": "Pioneer of the 2M+ token limit — 'reads' the whole book.",
    "truth_vs_speed": "Slower retrieval, high fidelity on long ranges.",
    "cultural_anchor": "China-developed, specialized in complex document structures.",
    "product_vs_model": "Self-branded as the 'Kimi' experience."
  }
}
